{
  "$schema": "https://json-schema.org/draft/2020-12/schema",
  "$id": "spots.schema.json",
  "title": "The pilgrimage spots: public places by name, address and coordinates, and what to say there",
  "description": "Place names only: no story details, screenshots, character art, quotes or logos. Which scene a spot is stays the learner's own note on the phone.",
  "type": "object",
  "required": ["version", "commonPhrases", "phrases", "spots"],
  "additionalProperties": false,
  "$defs": {
    "id": { "type": "string", "pattern": "^[a-z][a-z0-9]*(-[a-z0-9]+)*$" },
    "phraseRef": {
      "description": "A lesson phrase id (L23-01) or the id of a phrase in this file.",
      "type": "string",
      "pattern": "^(L[0-9]{2}-[0-9]{2}|[a-z][a-z0-9]*(-[a-z0-9]+)*)$"
    },
    "status": {
      "description": "draft → checked (cross-checked) → native (native speaker) → audio_ok (audio listened to)",
      "enum": ["draft", "checked", "native", "audio_ok"]
    },
    "checkedText": {
      "description": "The Italian text as it was when it was marked checked or later; must equal it unless status is draft.",
      "type": "string",
      "minLength": 1
    }
  },
  "properties": {
    "version": { "type": "integer", "minimum": 1 },
    "commonPhrases": {
      "description": "Lesson phrases for any spot, such as asking someone to take a photo.",
      "type": "array",
      "items": { "type": "string", "pattern": "^L[0-9]{2}-[0-9]{2}$" }
    },
    "phrases": {
      "description": "Sentences for the spots that aren't lesson phrases; lesson phrases are reused by id.",
      "type": "array",
      "items": {
        "type": "object",
        "required": ["id", "it", "zh", "status"],
        "additionalProperties": false,
        "properties": {
          "id": { "$ref": "#/$defs/id" },
          "it": { "type": "string", "minLength": 1 },
          "zh": { "type": "string", "minLength": 1 },
          "note": { "type": "string", "minLength": 1 },
          "status": { "$ref": "#/$defs/status" },
          "checkedText": { "$ref": "#/$defs/checkedText" }
        }
      }
    },
    "spots": {
      "type": "array",
      "minItems": 1,
      "items": {
        "type": "object",
        "required": ["id", "city", "it", "zh", "address", "latitude", "longitude", "phrases", "status"],
        "additionalProperties": false,
        "properties": {
          "id": { "$ref": "#/$defs/id" },
          "city": { "description": "A city id in course.json; for a day trip, the city it is made from.", "type": "string" },
          "dayTrip": { "description": "Reached on a day trip from the city rather than in it.", "type": "boolean" },
          "it": { "description": "The name in Italian, as signposted and said.", "type": "string", "minLength": 1 },
          "zh": { "type": "string", "minLength": 1 },
          "note": { "description": "Help with saying the name, in Chinese.", "type": "string", "minLength": 1 },
          "address": { "type": "string", "minLength": 1 },
          "latitude": { "type": "number", "minimum": -90, "maximum": 90 },
          "longitude": { "type": "number", "minimum": -180, "maximum": 180 },
          "pin": { "description": "For a place larger than a point: what the pin marks, in Chinese.", "type": "string", "minLength": 1 },
          "phrases": { "type": "array", "minItems": 1, "items": { "$ref": "#/$defs/phraseRef" } },
          "status": { "$ref": "#/$defs/status" },
          "checkedText": { "$ref": "#/$defs/checkedText" }
        }
      }
    }
  }
}
